"BROKEN","EPIC","FAILED","FEATURE","PASSED","SKIPPED","STORY","UNKNOWN"
"1","Избранное","0","Избранные фильмы пользователя","0","0","Успешное добавление в избранное","0"
"0","Регистрация","1","Создание аккаунта","0","0","Успешная регистрация пользователя","0"
"0","Авторизация","1","Вход в приложение","0","0","Успешный вход в аккаунт","0"
"1","Оценки и отзывы","0","Работа с отзывами","0","0","Успешное добавление оценки и отзыва о фильме","0"
"0","Поиск","1","Поиск фильмов","0","0","Успешный поиск фильма","0"
