"DESCRIPTION","DURATION IN MS","NAME","PARENT SUITE","START TIME","STATUS","STOP TIME","SUB SUITE","SUITE","TEST CLASS","TEST METHOD"
"","7647","Добавление фильма в избранное и раздел избранное в профиле","Избранное","Mon Dec 15 23:25:39 UTC 2025","broken","Mon Dec 15 23:25:46 UTC 2025","","","",""
"","4605","Успешная авторизация и проверка данных пользователя","Авторизация","Mon Dec 15 23:25:55 UTC 2025","failed","Mon Dec 15 23:26:00 UTC 2025","","","",""
"","4610","Поиск фильма, получение результатов в саджестах и на странице результатов поиска","Поиск","Mon Dec 15 23:26:07 UTC 2025","failed","Mon Dec 15 23:26:12 UTC 2025","","","",""
"","4635","Успешная регистрация и проверка данных пользователя","Регистрация","Mon Dec 15 23:26:01 UTC 2025","failed","Mon Dec 15 23:26:06 UTC 2025","","","",""
"","5611","Добавление оценки и отзыва к фильму","Оценки и отзывы","Mon Dec 15 23:25:48 UTC 2025","broken","Mon Dec 15 23:25:54 UTC 2025","","","",""
