"DESCRIPTION","DURATION IN MS","NAME","PARENT SUITE","START TIME","STATUS","STOP TIME","SUB SUITE","SUITE","TEST CLASS","TEST METHOD"
"","60188","Успешная авторизация и проверка данных пользователя","Авторизация","Mon Dec 15 11:36:52 UTC 2025","broken","Mon Dec 15 11:37:52 UTC 2025","","","",""
"","60181","Поиск фильма, получение результатов в саджестах и на странице результатов поиска","Поиск","Mon Dec 15 11:38:55 UTC 2025","broken","Mon Dec 15 11:39:56 UTC 2025","","","",""
"","60199","Добавление фильма в избранное и раздел избранное в профиле","Избранное","Mon Dec 15 11:34:49 UTC 2025","broken","Mon Dec 15 11:35:49 UTC 2025","","","",""
"","60272","Успешная регистрация и проверка данных пользователя","Регистрация","Mon Dec 15 11:37:54 UTC 2025","broken","Mon Dec 15 11:38:54 UTC 2025","","","",""
"","60272","Добавление оценки и отзыва к фильму","Оценки и отзывы","Mon Dec 15 11:35:50 UTC 2025","broken","Mon Dec 15 11:36:51 UTC 2025","","","",""
